{
  "id": "echosoundcore:blackbox_memory",
  "sound": "echosoundcore:music.blackbox.memory_fragment",
  "layer": "structure",
  "chapter": "BLACKBOX",
  "biome": "",
  "hazard": "",
  "structure": "echoblackboxprotocol:memory_archive",
  "faction": "",
  "loop": true,
  "fadeIn": 1.5,
  "fadeOut": 2.5,
  "volume": 0.75,
  "pitch": 1.0
}
